{
  "version": "v1",
  "transport": {
    "host": "0.0.0.0",
    "port": 8765
  },
  "decision_timeout_ms": 60000,
  "fallback_mode": "safe_continue",
  "logging": {
    "events": true,
    "prompts": true,
    "raw_provider_payloads": true
  },
  "policy_mapping": {
    "p1": "placeholder-p1",
    "p2": "placeholder-p2"
  },
  "policies": {
    "google/gemini-3.1-pro-preview": {
      "provider": "openrouter",
      "model": "google/gemini-3.1-pro-preview",
      "prompt_version": "strategic_v1",
      "credential_env_var": "OPENROUTER_API_KEY",
      "temperature": 0.7,
      "max_tokens": 2048,
      "options": {
        "title": "budok-ai",
        "response_parser": {
          "enable_correction_retry": true,
          "max_correction_retries": 1
        },
        "categories": "game"
      }
    },
    "openai/gpt-5.4": {
      "provider": "openrouter",
      "model": "openai/gpt-5.4",
      "prompt_version": "strategic_v1",
      "credential_env_var": "OPENROUTER_API_KEY",
      "temperature": 0.7,
      "max_tokens": 2048,
      "options": {
        "title": "budok-ai",
        "response_parser": {
          "enable_correction_retry": true,
          "max_correction_retries": 1
        },
        "categories": "game"
      }
    },
    "anthropic/claude-opus": {
      "provider": "anthropic",
      "model": "claude-opus-4-6",
      "prompt_version": "strategic_v1",
      "credential_env_var": "ANTHROPIC_API_KEY",
      "temperature": 0.7,
      "max_tokens": 2048,
      "options": {
        "response_parser": {
          "enable_correction_retry": true,
          "max_correction_retries": 1
        }
      }
    },
    "anthropic/claude-sonnet": {
      "provider": "anthropic",
      "model": "claude-sonnet-4-6",
      "prompt_version": "strategic_v1",
      "credential_env_var": "ANTHROPIC_API_KEY",
      "temperature": 0.7,
      "max_tokens": 2048,
      "options": {
        "response_parser": {
          "enable_correction_retry": true,
          "max_correction_retries": 1
        }
      }
    },
    "z-ai/glm-5": {
      "provider": "openrouter",
      "model": "z-ai/glm-5",
      "prompt_version": "strategic_v1",
      "credential_env_var": "OPENROUTER_API_KEY",
      "temperature": 0.7,
      "max_tokens": 2048,
      "options": {
        "title": "budok-ai",
        "response_parser": {
          "enable_correction_retry": true,
          "max_correction_retries": 1
        },
        "categories": "game"
      }
    },
    "minimax/minimax-m2.7": {
      "provider": "openrouter",
      "model": "minimax/minimax-m2.7",
      "prompt_version": "strategic_v1",
      "credential_env_var": "OPENROUTER_API_KEY",
      "temperature": 0.7,
      "max_tokens": 2048,
      "options": {
        "title": "budok-ai",
        "response_parser": {
          "enable_correction_retry": true,
          "max_correction_retries": 1
        },
        "categories": "game"
      }
    },
    "xiaomi/mimo-v2-pro": {
      "provider": "openrouter",
      "model": "xiaomi/mimo-v2-pro",
      "prompt_version": "strategic_v1",
      "credential_env_var": "OPENROUTER_API_KEY",
      "temperature": 0.7,
      "max_tokens": 2048,
      "options": {
        "title": "budok-ai",
        "response_parser": {
          "enable_correction_retry": true,
          "max_correction_retries": 1
        },
        "categories": "game"
      }
    },
    "x-ai/grok-4.20-beta": {
      "provider": "openrouter",
      "model": "x-ai/grok-4.20-beta",
      "prompt_version": "strategic_v1",
      "credential_env_var": "OPENROUTER_API_KEY",
      "temperature": 0.7,
      "max_tokens": 2048,
      "options": {
        "title": "budok-ai",
        "response_parser": {
          "enable_correction_retry": true,
          "max_correction_retries": 1
        },
        "categories": "game"
      }
    }
  },
  "character_selection": {
    "mode": "llm_choice"
  },
  "trace_seed": 1,
  "stage_id": "training_room",
  "match_options": {
    "starting_hp": 750
  }
}
