{
  "version": "v1",
  "transport": {
    "host": "127.0.0.1",
    "port": 8765
  },
  "decision_timeout_ms": 10000,
  "fallback_mode": "safe_continue",
  "logging": {
    "events": true,
    "prompts": true,
    "raw_provider_payloads": false
  },
  "policy_mapping": {
    "p1": "baseline/random",
    "p2": "baseline/random"
  },
  "policies": {
    "baseline/random": {
      "provider": "baseline",
      "prompt_version": "none"
    },
    "baseline/block_always": {
      "provider": "baseline",
      "prompt_version": "none"
    },
    "baseline/greedy_damage": {
      "provider": "baseline",
      "prompt_version": "none"
    },
    "baseline/scripted_safe": {
      "provider": "baseline",
      "prompt_version": "none"
    }
  },
  "character_selection": {
    "mode": "mirror"
  },
  "tournament": {
    "format": "round_robin",
    "mirror_matches_first": true,
    "side_swap": true,
    "games_per_pair": 10,
    "fixed_stage": "training_room"
  },
  "trace_seed": 0,
  "stage_id": "training_room",
  "replay_capture": {
    "enabled": true
  }
}
